{
  "contract": "bytedesk.release-status-head-authentication-evidence/1",
  "schema": {
    "id": "https://schemas.bytedesk.ai/agent-delivery/v1/release-status-head-authentication-evidence/1.0.0",
    "digest": "sha256:80de945991486aca16e229083880d1983b08ec00618239d9b46ff682355a92ed"
  },
  "purpose": "release-status-head-v1",
  "checkpointDigest": "sha256:90ca9c0a28fc0b98ac64b9b0550368ed7fa5fecfb08d889380e7410d5a5e8281",
  "requestNonce": "status_head_nonce_renderer-native-1_0_0-status-head-initial_0123456789abcdef",
  "authorityBindingDigest": "sha256:30a870af3677151355c1d260f6d308055df7b50996845fc958f0c8c89905f284",
  "signingResult": {
    "contract": "bytedesk.signing-result/1",
    "schema": {
      "id": "https://schemas.bytedesk.ai/agent-delivery/v1/signing-result/1.0.0",
      "digest": "sha256:a64e23f1ae5a04e0c26c67085a41e8d0d70a9df9d45b1ec789c72c7634543ede"
    },
    "requestId": "sign-renderer-native-1.0.0-status-head-initial",
    "requestDigest": "sha256:314210ae3462fdbc6392e6b5b39f9dc2288cddfe476982f6a35cc2f6c0e83a21",
    "purpose": "release-status-head-v1",
    "keyVersion": "kms://product/release-status-head-v1/versions/1",
    "algorithm": "ECDSA_P256_SHA256",
    "publicKeyDigest": "sha256:0a4c8de2f435b9898240bcd3231bac4df64dcfff75125fb71604f0aba9232cbc",
    "repository": "registry.example/product/status-heads",
    "subjectDigest": "sha256:90ca9c0a28fc0b98ac64b9b0550368ed7fa5fecfb08d889380e7410d5a5e8281",
    "subjectMediaType": "application/vnd.bytedesk.agent.release-status-head-checkpoint.v1+json",
    "signatureBundle": {
      "repository": "registry.example/product/status-heads",
      "digest": "sha256:7aa1f530ef9f53d2afd0c4604629523962452ad44bebe6606a95d3553fae0f37",
      "mediaType": "application/vnd.dev.sigstore.bundle.v0.3+json",
      "size": 2207,
      "trustPolicy": {
        "id": "release-status-head-v1",
        "digest": "sha256:6d815798af5b075b271a71366f3f085fae5e48eed0f61c7c5c03b71c046ab036"
      }
    },
    "trustPolicy": {
      "id": "release-status-head-v1",
      "digest": "sha256:6d815798af5b075b271a71366f3f085fae5e48eed0f61c7c5c03b71c046ab036"
    },
    "providerAuditEvidence": {
      "repository": "registry.example/product/status-heads",
      "digest": "sha256:923ed889f7db8a6db816d7d85a40836f32ef0d5425f2940e10153f47adc18d24",
      "mediaType": "application/vnd.bytedesk.agent.signer-authentication-evidence.v1+json",
      "size": 1766,
      "trustPolicy": {
        "id": "release-status-head-v1",
        "digest": "sha256:6d815798af5b075b271a71366f3f085fae5e48eed0f61c7c5c03b71c046ab036"
      }
    },
    "signedAt": "2026-07-17T12:00:01Z"
  },
  "evidenceDigest": "sha256:2fcbf19fac641d94529d7a8d609978f20271bd14ddb42c5c827365dea1326b67"
}
