{
  "contract": "bytedesk.release-status-head-authentication-evidence/1",
  "schema": {
    "id": "https://schemas.bytedesk.ai/agent-delivery/v1/release-status-head-authentication-evidence/1.0.0",
    "digest": "sha256:80de945991486aca16e229083880d1983b08ec00618239d9b46ff682355a92ed"
  },
  "purpose": "release-status-head-v1",
  "checkpointDigest": "sha256:a48b871fa3a2fb0e5e26f57816f1f0a94b5120da3ee71d975ca3e228e304dca0",
  "requestNonce": "status_head_nonce_renderer-native-1_0_0-status-head-refresh_0123456789abcdef",
  "authorityBindingDigest": "sha256:30a870af3677151355c1d260f6d308055df7b50996845fc958f0c8c89905f284",
  "signingResult": {
    "contract": "bytedesk.signing-result/1",
    "schema": {
      "id": "https://schemas.bytedesk.ai/agent-delivery/v1/signing-result/1.0.0",
      "digest": "sha256:a64e23f1ae5a04e0c26c67085a41e8d0d70a9df9d45b1ec789c72c7634543ede"
    },
    "requestId": "sign-renderer-native-1.0.0-status-head-refresh",
    "requestDigest": "sha256:67eb4cea0ebe527a88739ac83412c644a2e5ee718812bb01b9a620bfb0569890",
    "purpose": "release-status-head-v1",
    "keyVersion": "kms://product/release-status-head-v1/versions/1",
    "algorithm": "ECDSA_P256_SHA256",
    "publicKeyDigest": "sha256:0a4c8de2f435b9898240bcd3231bac4df64dcfff75125fb71604f0aba9232cbc",
    "repository": "registry.example/product/status-heads",
    "subjectDigest": "sha256:a48b871fa3a2fb0e5e26f57816f1f0a94b5120da3ee71d975ca3e228e304dca0",
    "subjectMediaType": "application/vnd.bytedesk.agent.release-status-head-checkpoint.v1+json",
    "signatureBundle": {
      "repository": "registry.example/product/status-heads",
      "digest": "sha256:9b9b0b415db5bed3b6a5d9330c6edc4fbfb3826422782e9d45eba916d883e801",
      "mediaType": "application/vnd.dev.sigstore.bundle.v0.3+json",
      "size": 2207,
      "trustPolicy": {
        "id": "release-status-head-v1",
        "digest": "sha256:6d815798af5b075b271a71366f3f085fae5e48eed0f61c7c5c03b71c046ab036"
      }
    },
    "trustPolicy": {
      "id": "release-status-head-v1",
      "digest": "sha256:6d815798af5b075b271a71366f3f085fae5e48eed0f61c7c5c03b71c046ab036"
    },
    "providerAuditEvidence": {
      "repository": "registry.example/product/status-heads",
      "digest": "sha256:7c55211c14a89251cb4679529b0412b5c61dcc25024d1bd83b7df52ea86a3323",
      "mediaType": "application/vnd.bytedesk.agent.signer-authentication-evidence.v1+json",
      "size": 1766,
      "trustPolicy": {
        "id": "release-status-head-v1",
        "digest": "sha256:6d815798af5b075b271a71366f3f085fae5e48eed0f61c7c5c03b71c046ab036"
      }
    },
    "signedAt": "2026-07-17T12:00:01Z"
  },
  "evidenceDigest": "sha256:b8dd9eee7b3f9d226d5c96368934c784043558c5b333e26ca9d6d6e0c0d4f4ca"
}
