{
  "contract": "bytedesk.release-status-head-authentication-evidence/1",
  "schema": {
    "id": "https://schemas.bytedesk.ai/agent-delivery/v1/release-status-head-authentication-evidence/1.0.0",
    "digest": "sha256:80de945991486aca16e229083880d1983b08ec00618239d9b46ff682355a92ed"
  },
  "purpose": "release-status-head-v1",
  "checkpointDigest": "sha256:5a1a68524b3a0851ab2b041dadf1ea3dea51135663593d65abb3bd18fb50e22c",
  "requestNonce": "qualification_finalization_renderer-openclaw-1_0_0-qualification-finalization-status-head_nonce_0123456789abcdef",
  "authorityBindingDigest": "sha256:30a870af3677151355c1d260f6d308055df7b50996845fc958f0c8c89905f284",
  "signingResult": {
    "contract": "bytedesk.signing-result/1",
    "schema": {
      "id": "https://schemas.bytedesk.ai/agent-delivery/v1/signing-result/1.0.0",
      "digest": "sha256:a64e23f1ae5a04e0c26c67085a41e8d0d70a9df9d45b1ec789c72c7634543ede"
    },
    "requestId": "sign-renderer-openclaw-1.0.0-qualification-finalization-status-head",
    "requestDigest": "sha256:c1ffb2bdb68f467b4e7d3c671270c41c2a5c4f831acda8e7b68f2482907e05a4",
    "purpose": "release-status-head-v1",
    "keyVersion": "kms://product/release-status-head-v1/versions/1",
    "algorithm": "ECDSA_P256_SHA256",
    "publicKeyDigest": "sha256:0a4c8de2f435b9898240bcd3231bac4df64dcfff75125fb71604f0aba9232cbc",
    "repository": "registry.example/product/status-heads",
    "subjectDigest": "sha256:5a1a68524b3a0851ab2b041dadf1ea3dea51135663593d65abb3bd18fb50e22c",
    "subjectMediaType": "application/vnd.bytedesk.agent.release-status-head-checkpoint.v1+json",
    "signatureBundle": {
      "repository": "registry.example/product/status-heads",
      "digest": "sha256:dc86bbd0aafdfe35e0e1247a8f09c7207b05806f7e6ef37c9cbd15498e37f15a",
      "mediaType": "application/vnd.dev.sigstore.bundle.v0.3+json",
      "size": 2228,
      "trustPolicy": {
        "id": "release-status-head-v1",
        "digest": "sha256:6d815798af5b075b271a71366f3f085fae5e48eed0f61c7c5c03b71c046ab036"
      }
    },
    "trustPolicy": {
      "id": "release-status-head-v1",
      "digest": "sha256:6d815798af5b075b271a71366f3f085fae5e48eed0f61c7c5c03b71c046ab036"
    },
    "providerAuditEvidence": {
      "repository": "registry.example/product/status-heads",
      "digest": "sha256:21e79b1198617be9db01b647b6c7b708a29a467e9c63f945f86588025d2af7fd",
      "mediaType": "application/vnd.bytedesk.agent.signer-authentication-evidence.v1+json",
      "size": 1829,
      "trustPolicy": {
        "id": "release-status-head-v1",
        "digest": "sha256:6d815798af5b075b271a71366f3f085fae5e48eed0f61c7c5c03b71c046ab036"
      }
    },
    "signedAt": "2026-07-17T12:00:01Z"
  },
  "evidenceDigest": "sha256:f6d493c0112adfdda7617ada06576f1fb5d67256d531ef1c5e28277b1d37c93c"
}
