{
  "contract": "bytedesk.release-status-head-authentication-evidence/1",
  "schema": {
    "id": "https://schemas.bytedesk.ai/agent-delivery/v1/release-status-head-authentication-evidence/1.0.0",
    "digest": "sha256:80de945991486aca16e229083880d1983b08ec00618239d9b46ff682355a92ed"
  },
  "purpose": "release-status-head-v1",
  "checkpointDigest": "sha256:935861c7467dad7e49c4a7e10bcf9ba02a79b7862e0ac4c1c3002c823abf1529",
  "requestNonce": "status_head_nonce_renderer-openclaw-1_0_0-status-head-initial_0123456789abcdef",
  "authorityBindingDigest": "sha256:30a870af3677151355c1d260f6d308055df7b50996845fc958f0c8c89905f284",
  "signingResult": {
    "contract": "bytedesk.signing-result/1",
    "schema": {
      "id": "https://schemas.bytedesk.ai/agent-delivery/v1/signing-result/1.0.0",
      "digest": "sha256:a64e23f1ae5a04e0c26c67085a41e8d0d70a9df9d45b1ec789c72c7634543ede"
    },
    "requestId": "sign-renderer-openclaw-1.0.0-status-head-initial",
    "requestDigest": "sha256:cac522eaa699f1d347ed41476e54ef9f2ffaec3d5e0b692699cb2171617f89bd",
    "purpose": "release-status-head-v1",
    "keyVersion": "kms://product/release-status-head-v1/versions/1",
    "algorithm": "ECDSA_P256_SHA256",
    "publicKeyDigest": "sha256:0a4c8de2f435b9898240bcd3231bac4df64dcfff75125fb71604f0aba9232cbc",
    "repository": "registry.example/product/status-heads",
    "subjectDigest": "sha256:935861c7467dad7e49c4a7e10bcf9ba02a79b7862e0ac4c1c3002c823abf1529",
    "subjectMediaType": "application/vnd.bytedesk.agent.release-status-head-checkpoint.v1+json",
    "signatureBundle": {
      "repository": "registry.example/product/status-heads",
      "digest": "sha256:356a4fab2bc9dd5f7a2789f28b6ac426ca7f87a6dee548b8a35f647024eed880",
      "mediaType": "application/vnd.dev.sigstore.bundle.v0.3+json",
      "size": 2209,
      "trustPolicy": {
        "id": "release-status-head-v1",
        "digest": "sha256:6d815798af5b075b271a71366f3f085fae5e48eed0f61c7c5c03b71c046ab036"
      }
    },
    "trustPolicy": {
      "id": "release-status-head-v1",
      "digest": "sha256:6d815798af5b075b271a71366f3f085fae5e48eed0f61c7c5c03b71c046ab036"
    },
    "providerAuditEvidence": {
      "repository": "registry.example/product/status-heads",
      "digest": "sha256:6d64f4082c73f255a158762fb3f41cc156423d8a6cc571e9dbed394a92d47e3a",
      "mediaType": "application/vnd.bytedesk.agent.signer-authentication-evidence.v1+json",
      "size": 1772,
      "trustPolicy": {
        "id": "release-status-head-v1",
        "digest": "sha256:6d815798af5b075b271a71366f3f085fae5e48eed0f61c7c5c03b71c046ab036"
      }
    },
    "signedAt": "2026-07-17T12:00:01Z"
  },
  "evidenceDigest": "sha256:9177d647bf71af0c155a28a97672b360a17d18e835f3e60327600e013d36616c"
}
